"A green light enters against stream, flush from the west,",neg
Against the current of obscure Arno ...,neg
"Look up, and you see things flying",neg
Between the day and the night;,neg
Swallows with spools of dark thread sewing the shadows together.,neg
"A circle swoop, and a quick parabola under the bridge arches",neg
Where light pushes through;,neg
A sudden turning upon itself of a thing in the air.,neg
A dip to the water.,neg
And you think:,neg
The swallows are flying so late!,neg
Swallows?,neg
Dark air-life looping,neg
Yet missing the pure loop ...,neg
"A twitch, a twitter, an elastic shudder in flight",neg
"And serrated wings against the sky,",neg
"Like a glove, a black glove thrown up at the light,",neg
And falling back.,neg
Never swallows!,neg
Bats!,neg
The swallows are gone.,neg
At a wavering instant the swallows gave way to bats,neg
By the Ponte Vecchio ...,neg
Changing guard.,neg
"Bats, and an uneasy creeping in one's scalp",neg
As the bats swoop overhead!,neg
Flying madly.,neg
Pipistrello!,neg
Black piper on an infinitesimal pipe.,neg
"Little lumps that fly in air and have voices indefinite, wildly vindictive;",neg
Wings like bits of umbrella.,neg
Bats!,neg
"Creatures that hang themselves up like an old rag, to sleep;",neg
And disgustingly upside down.,neg
Hanging upside down like rows of disgusting old rags,neg
And grinning in their sleep.,neg
Bats!,neg
In China the bat is symbol for happiness.,neg
Not for me!Notes:,neg
"Then you shall see her truly--your blood remembering its first invasion of her secrecy, its first encounters with her kind, her chieftain lover...his shade that haunts the lakes and hills",neg
The bronze General Grant riding a bronze horse in Lincoln Park,neg
Shrivels in the sun by day when the motor cars whirr by in long processions going somewhere to keep apppointment for dinner and matinees and buying and selling,neg
Though in the dusk and nightfall when high waves are piling,neg
On the slabs of the promenade along the lake shore near by,neg
I have seen the general dare the combers come closer,neg
And make to ride his bronze horse out into the hoofs and guns of the storm.,neg
I cross Lincoln Park on a winter night when the snow is falling.,neg
"Lincoln in bronze stands among the white lines of snow, his bronze forehead meeting soft echoes of the newsies crying forty thousand men are dead along the Yser, his bronze ears listening to the mumbled roar of the city at his bronze feet.",neg
"A lithe Indian on a bronze pony, Shakespeare seated with long legs in bronze, Garibaldi in a bronze cape, they hold places in the cold, lonely snow to-night on their pedestals and so they will hold them past midnight and into the dawn.",neg
Not in that wasted garden,neg
Where bodies are drawn into grass,neg
"That feeds no flocks, and into evergreens",neg
That bear no fruit ,neg
There where along the shaded walks,neg
"Vain sighs are heard,",neg
And vainer dreams are dreamed,neg
Of close communion with departed souls ,neg
But here under the apple tree,neg
I loved and watched and pruned,neg
With gnarled hands,neg
"In the long, long years;",neg
Here under the roots of this northern-spy,neg
"To move in the chemic change and circle of life,",neg
"Into the soil and into the flesh of the tree,",neg
And into the living epitaphs,neg
"Of redder apples!What large, dark hands are those at the window",neg
"Lifted, grasping the golden light",neg
Which weaves its way through the creeper leaves,neg
To my heart's delight?,neg
"Ah, only the leaves! But in the west,",neg
In the west I see a redness come,neg
Over the evening's burning breast ,neg
'Tis the wound of love goes home!,neg
The woodbine creeps abroad,neg
Calling low to her lover:,neg
The sun-lit flirt who all the day,neg
Has poised above her lips in play,neg
"And stolen kisses, shallow and gay",neg
"Of pollen, now has gone away",neg
" She woos the moth with her sweet, low word,",neg
And when above her his broad wings hover,neg
Then her bright breast she will uncover,neg
And yield her honey-drop to her lover.,neg
"Into the yellow, evening glow",neg
"Saunters a man from the farm below,",neg
"Leans, and looks in at the low-built shed",neg
Where hangs the swallow's marriage bed.,neg
The bird lies warm against the wall.,neg
She glances quick her startled eyes,neg
"Towards him, then she turns away",neg
"Her small head, making warm display",neg
Of red upon the throat. His terrors sway,neg
"Her out of the nest's warm, busy ball,",neg
Whose plaintive cry is heard as she flies,neg
In one blue stoop from out the sties,neg
Into the evening's empty hall.,neg
"Oh, water-hen, beside the rushes",neg
"Hide your quaint, unfading blushes,",neg
"Still your quick tail, and lie as dead,",neg
Till the distance folds over his ominous tread.,neg
"The rabbit presses back her ears,",neg
"Turns back her liquid, anguished eyes",neg
And crouches low: then with wild spring,neg
Spurts from the terror of his oncoming,neg
"To be choked back, the wire ring",neg
Her frantic effort throttling:,neg
Piteous brown ball of quivering fears!,neg
"Ah soon in his large, hard hands she dies,",neg
And swings all loose to the swing of his walk.,neg
Yet calm and kindly are his eyes,neg
And ready to open in brown surprise,neg
Should I not answer to his talk,neg
Or should he my tears surmise.,neg
"I hear his hand on the latch, and rise from my chair",neg
Watching the door open: he flashes bare,neg
"His strong teeth in a smile, and flashes his eyes",neg
In a smile like triumph upon me; then careless-wise,neg
He flings the rabbit soft on the table board,neg
"And comes towards me: ah, the uplifted sword",neg
"Of his hand against my bosom, and oh, the broad",neg
Blade of his hand that raises my face to applaud,neg
His coming: he raises up my face to him,neg
"And caresses my mouth with his fingers, which still smell grim",neg
"Of the rabbit's fur! God, I am caught in a snare!",neg
"I know not what fine wire is round my throat,",neg
I only know I let him finger there,neg
"My pulse of life, letting him nose like a stoat",neg
Who sniffs with joy before he drinks the blood:,neg
"And down his mouth comes to my mouth, and down",neg
His dark bright eyes descend like a fiery hood,neg
"Upon my mind: his mouth meets mine, and a flood",neg
"Of sweet fire sweeps across me, so I drown",neg
"Within him, die, and find death good.",neg
"See, the grass is full of stars,",neg
Fallen in their brightness;,neg
"Hearts they have of shining gold,",neg
Rays of shining whiteness.,neg
"Buttercups have honeyed hearts,",neg
"Bees they love the clover,",neg
But I love the daisies' dance,neg
All the meadow over.,neg
"Blow, O blow, you happy winds,",neg
"Singing summer's praises,",neg
Up the field and down the field,neg
A-dancing with the daisies.,neg
"This spring as it comes bursts up in bonfires green,",neg
"Wild puffing of emerald trees, and flame-filled bushes,",neg
Thorn-blossom lifting in wreaths of smoke between,neg
"Where the wood fumes up and the watery, flickering rushes.",neg
"I am amazed at this spring, this conflagration",neg
"Of green fires lit on the soil of the earth, this blaze",neg
"Of growing, and sparks that puff in wild gyration,",neg
Faces of people streaming across my gaze.,neg
"And I, what fountain of fire am I among",neg
This leaping combustion of spring? My spirit is tossed,neg
About like a shadow buffeted in the throng,neg
"Of flames, a shadow that's gone astray, and is lost.I never knew the earth had so much gold",neg
"The fields run over with it, and this hill",neg
"Hoary and old,",neg
Is young with buoyant blooms that flame and thrill.,neg
"Such golden fires, such yellowlo, how good",neg
"This spendthrift world, and what a lavish God!",neg
"This fringe of wood,",neg
Blazing with buttercup and goldenrod.,neg
"You too, beloved, are changed. Again I see",neg
"Your face grow mystical, as on that night",neg
"You turned to me,",neg
And all the trembling worldand youwere white.,neg
"Aye, you are touched; your singing lips grow dumb;",neg
"The fields absorb you, color you entire . . .",neg
And you become,neg
A goddess standing in a world of fire!The fog comes,neg
on little cat feet.,neg
It sits looking,neg
over harbor and city,neg
on silent haunches,neg
and then moves on.,neg
When she rises in the morning,neg
I linger to watch her;,neg
She spreads the bath-cloth underneath the window,neg
And the sunbeams catch her,neg
"Glistening white on the shoulders,",neg
While down her sides the mellow,neg
Golden shadow glows as,neg
"She stoops to the sponge, and her swung breasts",neg
Sway like full-blown yellow,neg
Gloire de Dijon roses.,neg
"She drips herself with water, and her shoulders",neg
"Glisten as silver, they crumple up",neg
"Like wet and falling roses, and I listen",neg
For the sluicing of their rain-dishevelled petals.,neg
In the window full of sunlight,neg
Concentrates her golden shadow,neg
"Fold on fold, until it glows as",neg
"Mellow as the glory roses.Pray why are you so bare, so bare,",neg
"Oh, bough of the old oak-tree;",neg
"And why, when I go through the shade you throw,",neg
Runs a shudder over me?,neg
"My leaves were green as the best, I trow,",neg
"And sap ran free in my veins,",neg
But I say in the moonlight dim and weird,neg
A guiltless victim's pains.,neg
I bent me down to hear his sigh;,neg
"I shook with his gurgling moan,",neg
"And I trembled sore when they rode away,",neg
And left him here alone.,neg
"They'd charged him with the old, old crime,",neg
And set him fast in jail:,neg
"Oh, why does the dog howl all night long,",neg
And why does the night wind wail?,neg
"He prayed his prayer and he swore his oath,",neg
And he raised his hand to the sky;,neg
"But the beat of hoofs smote on his ear,",neg
And the steady tread drew nigh.,neg
"Who is it rides by night, by night,",neg
Over the moonlit road?,neg
"And what is the spur that keeps the pace,",neg
What is the galling goad?,neg
"And now they beat at the prison door,",neg
"Ho, keeper, do not stay!",neg
"We are friends of him whom you hold within,",neg
And we fain would take him away,neg
From those who ride fast on our heels,neg
With mind to do him wrong;,neg
"They have no care for his innocence,",neg
And the rope they bear is long.,neg
"They have fooled the jailer with lying words,",neg
They have fooled the man with lies;,neg
"The bolts unbar, the locks are drawn,",neg
And the great door open flies.,neg
"Now they have taken him from the jail,",neg
"And hard and fast they ride,",neg
"And the leader laughs low down in his throat,",neg
As they halt my trunk beside.,neg
"Oh, the judge, he wore a mask of black,",neg
"And the doctor one of white,",neg
"And the minister, with his oldest son,",neg
Was curiously bedight.,neg
"Oh, foolish man, why weep you now?",neg
"'Tis but a little space,",neg
And the time will come when these shall dread,neg
The mem'ry of your face.,neg
"I feel the rope against my bark,",neg
"And the weight of him in my grain,",neg
I feel in the throe of his final woe,neg
The touch of my own last pain.,neg
And never more shall leaves come forth,neg
On the bough that bears the ban;,neg
"I am burned with dread, I am dried and dead,",neg
From the curse of a guiltless man.,neg
"And ever the judge rides by, rides by,",neg
"And goes to hunt the deer,",neg
And ever another rides his soul,neg
In the guise of a mortal fear.,neg
"And ever the man he rides me hard,",neg
And never a night stays he;,neg
"For I feel his curse as a haunted bough,",neg
On the trunk of a haunted tree.When I am dead and over me bright April,neg
"Shakes out her rain-drenched hair,",neg
"Tho' you should lean above me broken-hearted,",neg
I shall not care.,neg
"I shall have peace, as leafy trees are peaceful",neg
"When rain bends down the bough,",neg
And I shall be more silent and cold-hearted,neg
Than you are now.in Just-,neg
spring when the world is mud-,neg
luscious the little,neg
lame balloonman,neg
whistles far and wee,neg
and eddieandbill come,neg
running from marbles and,neg
piracies and it's,neg
spring,neg
when the world is puddle-wonderful,neg
the queer,neg
old balloonman whistles,neg
far and wee,neg
and bettyandisbel come dancing,neg
from hop-scotch and jump-rope and,neg
it's spring and the goat-footed balloonMan whistles,neg
"I will arise and go now, and go to Innisfree,",neg
"And a small cabin build there, of clay and wattles made;",neg
"Nine bean-rows will I have there, a hive for the honey-bee,",neg
And live alone in the bee-loud glade.,neg
"And I shall have some peace there, for peace comes dropping slow,",neg
Dropping from the veils of the morning to where the cricket sings;,neg
"There midnights all a glimmer, and noon a purple glow,",neg
And evening full of the linnets wings.,neg
"I will arise and go now, for always night and day",neg
I hear lake water lapping with low sounds by the shore;,neg
"While I stand on the roadway, or on the pavements grey,",neg
I hear it in the deep hearts core.,neg
little tree,neg
little silent Christmas tree,neg
you are so little,neg
you are more like a flower,neg
who found you in the green forest,neg
and were you very sorry to come away?,neg
see i will comfort you,neg
because you smell so sweetly,neg
i will kiss your cool bark,neg
and hug you safe and tight,neg
"just as your mother would,",neg
only don't be afraid,neg
look the spangles,neg
that sleep all the year in a dark box,neg
"dreaming of being taken out and allowed to shine,",neg
"the balls the chains red and gold the fluffy threads,",neg
put up your little arms,neg
and i'll give them all to you to hold,neg
every finger shall have its ring,neg
and there won't be a single place dark or unhappy,neg
then when you're quite dressed,neg
you'll stand in the window for everyone to see,neg
and how they'll stare!,neg
oh but you'll be very proud,neg
and my little sister and i will take hands,neg
and looking up at our beautiful tree,neg
we'll dance and sing,neg
Rugged and straight he stood; his body steeled,neg
With stubbornness and age. We met his eyes,neg
"That never flinched or turned to compromise,",neg
"And Luck, he cried, good luck!and waved an arm,",neg
"Knotted and sailor-like, such as no farm",neg
In all of Maine could boast of; and away,neg
He turned again to pitch his new-cut hay...,neg
We walked on leisurely until a bend,neg
"Showed him once more, now working toward the end",neg
Of one great path; wearing his eighty years,neg
Like banners lifted in a wind of cheers.,neg
Then we turned off abruptlytook the road,neg
"Cutting the village, the one with the commanding",neg
View of the river. And we strode,neg
More briskly now to the long pier that showed,neg
Where the frail boats were kept at Indian Landing.,neg
In the canoe we stepped; our paddles dipped,neg
"Leisurely downwards, and the slim bark slipped",neg
More on than in the water. Smoothly then,neg
"We shot its nose against the rippling current,",neg
Feeling the rising rivers half-deterrent,neg
Pull on the paddle as we turned the blade,neg
To keep from swerving round; while we delayed,neg
To watch the curious wave-eaten locks;,neg
"Or pass, with lazy turns, the picnic-rocks....",neg
"Blue eels flew under us, and fishes darted",neg
A thousand ways; the once broad channel shrunk.,neg
And over us the wise and noble-hearted,neg
"Twilight leaned down; the sunset mists were parted,",neg
"And we, with thoughts on tiptoe, slunk",neg
"Down the green, twisting alleys of the Kennebunk,",neg
Motionless in the meadows,neg
"The trees, the rocks, the cows...",neg
And quiet dripped from the shadows,neg
Like rain from heavy boughs.,neg
The tree-toads started ringing,neg
Their ceaseless silver bells;,neg
A land-locked breeze came swinging,neg
Its censer of earthy smells.,neg
The rivers tiny canon,neg
Stretched into dusky lands;,neg
Like a dark and silent companion,neg
Evening held out her hands.,neg
Hushed were the dawns bravados;,neg
Loud noon was a silenced cry,neg
And quiet slipped from the shadows,neg
As stars slip out of the sky...,neg
"It must have been an hour more, or later,",neg
"When, tramping homeward through the piney wood,",neg
We felt the years fly back; the brotherhood,neg
Of forests took usand we saw the satyr!,neg
"There in a pool, up to his neck, he stood",neg
"And grinned to see us stare, incredulous",neg
Too startled to remember fear or flight.,neg
"Feeling the menace in the crafty night,",neg
"We turned to runwhen lo, he called to us!",neg
Using our very names he called. We drew,neg
With creaking courage down the avenue,neg
"Of birches till we saw, with clearing sight,",neg
"(No longer through a tricky, pale-green light)",neg
"Familiar turns and shrubs, the friendly path,",neg
And Farmer Boothby in his woodland bath!,neg
The woods became his background; every tree,neg
"Seemed part of him, and stood erect, and shared",neg
The beauty of that gnarled serenity;,neg
The quiet vigor of age that smiled and squared,neg
Its shoulders against Time ... And even night,neg
"Flowed in and out of him, as though content",neg
With such a native element;,neg
Happy to move about a spirit quite,neg
"As old, as placid and as confident...",neg
Sideways we turned. Still glistening and unclad,neg
"He leaped up on the bank, light as a lad,",neg
His body in the moonlight dripping stars...,neg
"We went on homeward, through the pasture-bars.Moonmoth and grasshopper that flee our page",neg
"And still wing on, untarnished of the name",neg
We pinion to your bodies to assuage,neg
Our envy of your freedomwe must maim,neg
"Because we are usurpers, and chagrined",neg
And take the wing and scar it in the hand.,neg
"Names we have, even, to clap on the wind;",neg
"But we must die, as you, to understand.",neg
"I dreamed that all men dropped their names, and sang",neg
"As only they can praise, who build their days",neg
"With fin and hoof, with wing and sweetened fang",neg
Struck free and holy in one Name always.,neg
She has no need to fear the fall,neg
Of harvest from the laddered reach,neg
"Of orchards, nor the tide gone ebbing",neg
From the steep beach.,neg
Nor hold to pain's effrontery,neg
"Her body's bulwark, stern and savage,",neg
"Nor be a glass, where to forsee",neg
Another's ravage.,neg
"What she has gathered, and what lost,",neg
She will not find to lose again.,neg
"She is possessed by time, who once",neg
Was loved by men.,neg
The winter evening settles down,neg
With smell of steaks in passageways.,neg
Six oclock.,neg
The burnt-out ends of smoky days.,neg
And now a gusty shower wraps,neg
The grimy scraps,neg
Of withered leaves about your feet,neg
And newspapers from vacant lots;,neg
The showers beat,neg
"On broken blinds and chimney-pots,",neg
And at the corner of the street,neg
A lonely cab-horse steams and stamps.,neg
And then the lighting of the lamps.,neg
The morning comes to consciousness,neg
Of faint stale smells of beer,neg
From the sawdust-trampled street,neg
With all its muddy feet that press,neg
To early coffee-stands.,neg
With the other masquerades,neg
"That time resumes,",neg
One thinks of all the hands,neg
That are raising dingy shades,neg
In a thousand furnished rooms.,neg
"You tossed a blanket from the bed,",neg
"You lay upon your back, and waited;",neg
"You dozed, and watched the night revealing",neg
The thousand sordid images,neg
Of which your soul was constituted;,neg
They flickered against the ceiling.,neg
And when all the world came back,neg
And the light crept up between the shutters,neg
"And you heard the sparrows in the gutters,",neg
You had such a vision of the street,neg
As the street hardly understands;,neg
"Sitting along the beds edge, where",neg
"You curled the papers from your hair,",neg
Or clasped the yellow soles of feet,neg
In the palms of both soiled hands.,neg
His soul stretched tight across the skies,neg
"That fade behind a city block,",neg
Or trampled by insistent feet,neg
At four and five and six oclock;,neg
"And short square fingers stuffing pipes,",neg
"And evening newspapers, and eyes",neg
"Assured of certain certainties,",neg
The conscience of a blackened street,neg
Impatient to assume the world.,neg
I am moved by fancies that are curled,neg
"Around these images, and cling:",neg
The notion of some infinitely gentle,neg
Infinitely suffering thing.,neg
"Wipe your hand across your mouth, and laugh;",neg
The worlds revolve like ancient women,neg
"Gathering fuel in vacant lots.The willows carried a slow sound,",neg
A sarabande the wind mowed on the mead.,neg
I could never remember,neg
"That seething, steady leveling of the marshes",neg
Till age had brought me to the sea.,neg
"Flags, weeds. And remembrance of steep alcoves",neg
Where cypresses shared the noons,neg
Tyranny; they drew me into hades almost.,neg
And mammoth turtles climbing sulphur dreams,neg
"Yielded, while sun-silt rippled them",neg
Asunder ...,neg
How much I would have bartered! the black gorge,neg
And all the singular nestings in the hills,neg
Where beavers learn stitch and tooth.,neg
The pond I entered once and quickly fled,neg
I remember now its singing willow rim.,neg
"And finally, in that memory all things nurse;",neg
After the city that I finally passed,neg
With scalding unguents spread and smoking darts,neg
The monsoon cut across the delta,neg
"At gulf gates ... There, beyond the dykes",neg
"I heard wind flaking sapphire, like this summer,",neg
And willows could not hold more steady sound.Twelve o'clock.,neg
Along the reaches of the street,neg
"Held in a lunar synthesis,",neg
Whispering lunar incantations,neg
Dissolve the floors of memory,neg
"And all its clear relations,",neg
"Its divisions and precisions,",neg
Every street lamp that I pass,neg
"Beats like a fatalistic drum,",neg
And through the spaces of the dark,neg
Midnight shakes the memory,neg
As a madman shakes a dead geranium.,neg
"Half-past one,",neg
"The street lamp sputtered,",neg
"The street lamp muttered,",neg
"The street lamp said, ""Regard that woman",neg
Who hesitates towards you in the light of the door,neg
Which opens on her like a grin.,neg
You see the border of her dress,neg
"Is torn and stained with sand,",neg
And you see the corner of her eye,neg
"Twists like a crooked pin.""",neg
The memory throws up high and dry,neg
A crowd of twisted things;,neg
A twisted branch upon the beach,neg
"Eaten smooth, and polished",neg
As if the world gave up,neg
"The secret of its skeleton,",neg
Stiff and white.,neg
"A broken spring in a factory yard,",neg
Rust that clings to the form that the strength has left,neg
Hard and curled and ready to snap.,neg
"Half-past two,",neg
"The street lamp said,",neg
"Remark the cat which flattens itself in the gutter,
Slips out its tongue
And devours a morsel of rancid butter.",neg
"So the hand of a child, automatic,",neg
Slipped out and pocketed a toy that was running along the quay.,neg
I could see nothing behind that child's eye.,neg
I have seen eyes in the street,neg
"Trying to peer through lighted shutters,",neg
"And a crab one afternoon in a pool,",neg
"An old crab with barnacles on his back,",neg
Gripped the end of a stick which I held him.,neg
"Half-past three,",neg
"The lamp sputtered,",neg
The lamp muttered in the dark.,neg
The lamp hummed:,neg
Regard the moon,neg
La lune ne garde aucune rancune,neg
She winks a feeble eye,neg
She smiles into corners.,neg
She smoothes the hair of the grass.,neg
The moon has lost her memory.,neg
A washed-out smallpox cracks her face,neg
Her hand twists a paper rose,neg
That smells of dust and old Cologne,neg
She is alone,neg
With all the old nocturnal smells,neg
That cross and cross across her brain.,neg
The reminiscence comes,neg
Of sunless dry geraniums,neg
"And dust in crevices,",neg
"Smells of chestnuts in the streets,",neg
"And female smells in shuttered rooms,",neg
And cigarettes in corridors,neg
"And cocktail smells in bars.""",neg
"The lamp said,",neg
"Four o'clock,",neg
Here is the number on the door.,neg
Memory!,neg
"You have the key,",neg
"The little lamp spreads a ring on the stair,",neg
Mount.,neg
"The bed is open; the tooth-brush hangs on the wall,",neg
"Put your shoes at the door, sleep, prepare for life.",neg
The last twist of the knife.,neg
"Out of the winds' and the waves' riot,",neg
"Out of the loud foam,",neg
He has put in to a great quiet,neg
And a still home.,neg
Here he may lie at ease and wonder,neg
"Why the old ship waits,",neg
And hark for the surge and the strong thunder,neg
"Of the full Straits,",neg
"And look for the fishing fleet at morning,",neg
"Shadows like lost souls,",neg
Slide through the fog where the seal's warning,neg
"Betrays the shoals,",neg
And watch for the deep-sea liner climbing,neg
"Out of the bright West,",neg
With a salmon-sky and her wake shining,neg
"Like a tern's breast, ",neg
And never know he is done for ever,neg
"With the old sea's pride,",neg
Borne from the fight and the full endeavour,neg
"On an ebb tide.Maurice, weep not, I am not here under this pine tree.",neg
"The balmy air of spring whispers through the sweet grass,",neg
"The stars sparkle, the whippoorwill calls,",neg
"But thou grievest, while my soul lies rapturous",neg
In the blest Nirvana of eternal light!,neg
"Go to the good heart that is my husband,",neg
Who broods upon what he calls our guilty love: i,neg
"Tell him that my love for you, no less than my love for him",neg
Wrought out my destiny i that through the flesh,neg
"I won spirit, and through spirit, peace.",neg
"There is no marriage in heaven,",neg
But there is love.,neg
The earth builds on the earth,neg
Castles and towers;,neg
The earth saith of the earth:,neg
All shall be ours.,neg
"Yea, though they plan and reap",neg
"The rye and the corn,",neg
"Lo, they were bond to Sleep",neg
Ere they were born.,neg
"Yea, though the blind earth sows",neg
"For the fruit and the sheaf,",neg
They shall harvest the leaf of the rose,neg
And the dust of the leaf.,neg
Pride of the sword and power,neg
Are theirs at their need,neg
Who shall rule but the root of the flower,neg
The fall of the seed.,neg
They who follow the flesh,neg
"In splendour and tears,",neg
They shall rest and clothe them afresh,neg
In the fulness of years.,neg
