"The better angel is a man right fair,",neg
The worser spirit a woman coloured ill.,neg
"To win me soon to hell, my female evil",neg
"Tempteth my better angel from my side,",neg
"And would corrupt my saint to be a devil,",neg
Wooing his purity with her foul pride.,neg
"And, whether that my angel be turnd fiend,",neg
"Suspect I may, yet not directly tell,",neg
"But being both from me both to each friend,",neg
I guess one angel in anothers hell.,neg
"   Yet this shall I neer know, but live in doubt,",neg
   Till my bad angel fire my good one out.,neg
"   I that have been a lover, and could show it,",neg
"Though not in these, in rithmes not wholly dumb,",neg
"Since I exscribe your sonnets, am become",neg
"A better lover, and much better poet.",neg
Nor is my Muse or I ashamed to owe it,neg
"To those true numerous graces, whereof some",neg
"But charm the senses, others overcome",neg
Both brains and hearts; and mine now best do know it:,neg
"For in your verse all Cupids armory,",neg
"His flames, his shafts, his quiver, and his bow,",neg
His very eyes are yours to overthrow.,neg
"But then his mothers sweets you so apply,",neg
"Her joys, her smiles, her loves, as readers take",neg
For Venus ceston every line you make.,neg
"Take, oh, take those lips away",neg
That so sweetly were forsworn,neg
"And those eyes, like break of day,",neg
Lights that do mislead the morn;,neg
"But my kisses bring again,",neg
"Seals of love, though sealed in vain.",neg
"Hide, oh, hide those hills of snow,",neg
"Which thy frozen bosom bears,",neg
On whose tops the pinks that grow,neg
Are of those that April wears;,neg
"But first set my poor heart free,",neg
Bound in those icy chains by thee.,neg
"Though I am young, and cannot tell",neg
"    Either what Death or Love is well,",neg
"Yet I have heard they both bear darts,",neg
    And both do aim at human hearts.,neg
"And then again, I have been told",neg
"    Love wounds with heat, as Death with cold;",neg
So that I fear they do but bring,neg
"    Extremes to touch, and mean one thing.",neg
As in a ruin we it call,neg
"    One thing to be blown up, or fall;",neg
Or to our end like way may have,neg
"    By a flash of lightning, or a wave;",neg
So Loves inflamed shaft or brand,neg
    May kill as soon as Deaths cold hand;,neg
Except Loves fires the virtue have,neg
    To fright the frost out of the grave.,neg
"    Though that men do call it dotage,",neg
Who loveth not wanteth courage;,neg
"And whosoever may love get,",neg
From Venus sure he must it fet,neg
"Or else from her which is her heir,",neg
And she to him must seem most fair.,neg
With eye and mind doth both agree.,neg
There is no boot: there must it be.,neg
"The eye doth look and represent,",neg
But mind afformeth with full consent.,neg
Thus am I fixed without grudge:,neg
Mine eye with heart doth me so judge.,neg
Love maintaineth all noble courage.,neg
Who love disdaineth is all of the village:,neg
Such loversthough they take pain,neg
"It were pity they should obtain,",neg
For often times where they do sue,neg
They hinder lovers that would be true.,neg
For whoso loveth should love but once.,neg
"Change whoso will, I will be none.",neg
"Come, Madam, come, all rest my powers defy,",neg
"Until I labour, I in labour lie.",neg
"The foe oft-times having the foe in sight,",neg
Is tird with standing though he never fight.,neg
"Off with that girdle, like heavens Zone glistering,",neg
But a far fairer world encompassing.,neg
"Unpin that spangled breastplate which you wear,",neg
That theyes of busy fools may be stopped there.,neg
"Unlace yourself, for that harmonious chime,",neg
"Tells me from you, that now it is bed time.",neg
"Off with that happy busk, which I envy,",neg
"That still can be, and still can stand so nigh.",neg
"Your gown going off, such beauteous state reveals,",neg
As when from flowery meads thhills shadow steals.,neg
Off with that wiry Coronet and shew,neg
The hairy Diadem which on you doth grow:,neg
"Now off with those shoes, and then safely tread",neg
"In this loves hallowd temple, this soft bed.",neg
"In such white robes, heavens Angels used to be",neg
Received by men; Thou Angel bringst with thee,neg
A heaven like Mahomets Paradise; and though,neg
"Ill spirits walk in white, we easily know,",neg
"By this these Angels from an evil sprite,",neg
"Those set our hairs, but these our flesh upright.",neg
"    Licence my roving hands, and let them go,",neg
"Before, behind, between, above, below.",neg
"O my America! my new-found-land,",neg
"My kingdom, safeliest when with one man mannd,",neg
"My Mine of precious stones, My Empirie,",neg
How blest am I in this discovering thee!,neg
"To enter in these bonds, is to be free;",neg
"Then where my hand is set, my seal shall be.",neg
"    Full nakedness! All joys are due to thee,",neg
"As souls unbodied, bodies unclothd must be,",neg
To taste whole joys. Gems which you women use,neg
"Are like Atlantas balls, cast in mens views,",neg
"That when a fools eye lighteth on a Gem,",neg
"His earthly soul may covet theirs, not them.",neg
"Like pictures, or like books gay coverings made",neg
"For lay-men, are all women thus arrayd;",neg
"Themselves are mystic books, which only we",neg
(Whom their imputed grace will dignify),neg
Must see reveald. Then since that I may know;,neg
"As liberally, as to a Midwife, shew",neg
"Thy self: cast all, yea, this white linen hence,",neg
There is no penance due to innocence.,neg
"    To teach thee, I am naked first; why then",neg
What needst thou have more covering than a man.,neg
"Merry Margaret,",neg
"As midsummer flower,",neg
Gentle as a falcon,neg
Or hawk of the tower:,neg
"With solace and gladness,",neg
"Much mirth and no madness,",neg
All good and no badness;,neg
"So joyously,",neg
"So maidenly,",neg
So womanly,neg
Her demeaning,neg
"In every thing,",neg
"Far, far passing",neg
"That I can indite,",neg
Or suffice to write,neg
Of Merry Margaret,neg
"As midsummer flower,",neg
Gentle as falcon,neg
Or hawk of the tower.,neg
As patient and still,neg
And as full of good will,neg
"As fair Isaphill,",neg
"Coriander,",neg
"Sweet pomander,",neg
"Good Cassander,",neg
"Steadfast of thought,",neg
"Well made, well wrought,",neg
Far may be sought,neg
Ere that ye can find,neg
"So courteous, so kind",neg
"As Merry Margaret,",neg
"This midsummer flower,",neg
Gentle as falcon,neg
Or hawk of the tower.,neg
That neither fame nor love might wanting be,neg
"To greatness, Cary, I sing that and thee;",neg
"Whose house, if it no other honor had,",neg
In only thee might be both great and glad;,neg
"Who, to upbraid the sloth of this our time,",neg
"Durst valor make almost, but not, a crime;",neg
"Which deed I know not, whether were more high,",neg
"Or thou more happy, it to justify",neg
"Against thy fortune: when no foe, that day,",neg
"Could conquer thee but chance, who did betray.",neg
"Love thy great loss, which a renown hath won,",neg
"To live when Broick not stands, nor Ruhr doth run.",neg
"Love honors, which of best example be",neg
When they cost dearest and are done most free;,neg
"Though every fortitude deserves applause,",neg
It may be much or little in the cause.,neg
"Hes valiantst that dares fight, and not for pay;",neg
"That virtuous is, when the rewards away.",neg
"Methought I saw the grave where Laura lay,",neg
Within that temple where the vestal flame,neg
"Was wont to burn; and, passing by that way,",neg
"To see that buried dust of living fame,",neg
"Whose tomb fair Love, and fairer Virtue kept:",neg
All suddenly I saw the Fairy Queen;,neg
"At whose approach the soul of Petrarch wept,",neg
"And, from thenceforth, those Graces were not seen:",neg
For they this queen attended; in whose stead,neg
Oblivion laid him down on Lauras hearse:,neg
"Hereat the hardest stones were seen to bleed,",neg
And groans of buried ghosts the heavens did pierce:,neg
"Where Homers spright did tremble all for grief,",neg
And cursed the access of that celestial thief!,neg
"When thou must home to shades of underground,",neg
"And there arrived, a new admired guest,",neg
"The beauteous spirits do engirt thee round,",neg
"White Iope, blithe Helen, and the rest,",neg
To hear the stories of thy finished love,neg
From that smooth tongue whose music hell can move;,neg
"Then wilt thou speak of banqueting delights,",neg
"Of masques and revels which sweet youth did make,",neg
"Of tourneys and great challenges of knights,",neg
And all these triumphs for thy beautys sake:,neg
"When thou hast told these honours done to thee,",neg
"Then tell, O tell, how thou didst murder me!",neg
As you came from the holy land,neg
of Walsinghame,neg
Met you not with my true love,neg
By the way as you came?,neg
How shall I know your true love,neg
That have met many one,neg
As I went to the holy land,neg
"That have come, that have gone?",neg
She is neither white nor brown,neg
But as the heavens fair,neg
There is none hath a form so divine,neg
In the earth or the air.,neg
"Such an one did I meet, good Sir,",neg
"Such an Angelic face,",neg
"Who like a queen, like a nymph, did appear",neg
"By her gait, by her grace.",neg
"She hath left me here all alone,",neg
"All alone as unknown,",neg
"Who sometimes did me lead with her self,",neg
And me loved as her own.,neg
Whats the cause that she leaves you alone,neg
And a new way doth take;,neg
Who loved you once as her own,neg
And her joy did you make?,neg
"I have loved her all my youth,",neg
"But now old, as you see,",neg
Love likes not the falling fruit,neg
From the withered tree.,neg
Know that love is a careless child,neg
"And forgets promise past,",neg
"He is blind, he is deaf when he list",neg
And in faith never fast.,neg
His desire is a dureless content,neg
And a trustless joy,neg
He is won with a world of despair,neg
And is lost with a toy.,neg
Of womenkind such indeed is the love,neg
Or the word Love abused,neg
Under which many childish desires,neg
And conceits are excused.,neg
But true Love is a durable fire,neg
In the mind ever burning;,neg
"Never sick, never old, never dead,",neg
From itself never turning.,neg
"What length of verse can serve brave Mopsas good to show,",neg
"Whose virtues strange, and beauties such, as no man them may know?",neg
"Thus shrewdly burden, then, how can my Muse escape?",neg
"The gods must help, and precious things must serve to show her shape.",neg
"Like great god Saturn, fair, and like fair Venus, chaste;",neg
"As smooth as Pan, as Juno mild, like goddess Iris fast.",neg
"With Cupid she foresees, and goes god Vulcans pace;",neg
"And for a taste of all these gifts, she borrows Momus grace.",neg
"Her forehead jacinth-like, her cheeks of opal hue,",neg
"Her twinkling eyes bedecked with pearl, her lips of sapphire blue,",neg
"Her hair pure crapall stone, her mouth, O heavenly wide,",neg
"Her skin like burnished gold, her hands like silver ore untried.",neg
"As for those parts unknown, which hidden sure are best,",neg
"Happy be they which believe, and never seek the rest.",neg
"When I was fair and young, then favor graced me.",neg
Of many was I sought their mistress for to be.,neg
But I did scorn them all and answered them therefore:,neg
"Go, go, go, seek some other where; importune me no more.",neg
"How many weeping eyes I made to pine in woe,",neg
"How many sighing hearts I have not skill to show,",neg
But I the prouder grew and still this spake therefore:,neg
"Go, go, go, seek some other where, importune me no more.",neg
"Then spake fair Venus son, that proud victorious boy,",neg
"Saying: You dainty dame, for that you be so coy,",neg
I will so pluck your plumes as you shall say no more:,neg
"Go, go, go, seek some other where, importune me no more.",neg
"As soon as he had said, such change grew in my breast",neg
That neither night nor day I could take any rest.,neg
Wherefore I did repent that I had said before:,neg
"Go, go, go, seek some other where, importune me no more.",neg
"When to her lute Corinna sings,",neg
"Her voice revives the leaden strings,",neg
And doth in highest notes appear,neg
As any challenged echo clear;,neg
"But when she doth of mourning speak,",neg
Evn with her sighs the strings do break.,neg
"And as her lute doth live or die,",neg
"Let by her passion, so must I:",neg
"For when of pleasure she doth sing,",neg
"My thoughts enjoy a sudden spring,",neg
"But if she doth of sorrow speak,",neg
Evn from my heart the strings do break.,neg
"Now thou has loved me one whole day,",neg
"Tomorrow when you leavst, what wilt thou say?",neg
Wilt thou then antedate some new-made vow?,neg
            Or say that now,neg
We are not just those persons which we were?,neg
"Or, that oaths made in reverential fear",neg
"Of Love, and his wrath, any may forswear?",neg
"Or, as true deaths true marriages untie,",neg
"So lovers contracts, images of those,",neg
"Bind but till sleep, deaths image, them unloose?",neg
"            Or, your own end to justify,",neg
"For having purposed change and falsehood, you",neg
Can have no way but falsehood to be true?,neg
"Vain lunatic, against these scapes I could",neg
"            Dispute and conquer, if I would,",neg
"            Which I abstain to do,",neg
"For by tomorrow, I may think so too.",neg
"Womanhood, wanton, ye want:",neg
"Your meddling, mistress, is mannerless;",neg
"Plenty of ill, of goodness scant,",neg
"Ye rail at riot, reckless:",neg
To praise your port it is needless;,neg
"For all your draff yet and your dregs,",neg
As well borne as ye full oft time begs.,neg
Why so coy and full of scorn?,neg
"Mine horse is sold, I ween, you say;",neg
"My new furred gown, when it is worn...",neg
"Put up your purse, ye shall not pay!",neg
"By crede, I trust to see the day,",neg
"As proud a pea-hen as ye spread,",neg
Of me and other ye may have need!,neg
"Though angelic be your smiling,",neg
"Yet is your tongue an adders tail,",neg
Full like a scorpion stinging,neg
All those by whom ye have avail.,neg
"Good mistress Anne, there ye do shail:",neg
"What prate ye, pretty pigesnye?",neg
I trust to quite you ere I die!,neg
"Your key is meet for every lock,",neg
Your key is common and hangeth out;,neg
"Your key is ready, we need not knock,",neg
Nor stand long wresting there about;,neg
Of your door-gate ye have no doubt:,neg
"But one thing is, that ye be lewd:",neg
"Hold your tongue now, all beshrewd!",neg
"To mistress Anne, that farly sweet,",neg
That wones at The Key in Thames Street.,neg
" Wyatt resteth here, that quick could never rest;",neg
"Whose heavenly gifts increased by disdain,",neg
And virtue sank the deeper in his breast;,neg
Such profit he of envy could obtain.,neg
"A head, where wisdom mysteries did frame,",neg
Whose hammers beat still in that lively brain,neg
"As on a stith, where some work of fame",neg
"Was daily wrought, to turn to Britains gain.",neg
"A visage, stern and mild; where both did grow,",neg
"Vice to condemn, in virtues to rejoice;",neg
"Amid great storms whom grace assured so,",neg
To live upright and smile at fortunes choice.,neg
A hand that taught what might be said in rhyme;,neg
That reft Chaucer the glory of his wit;,neg
"A mark the which (unperfited, for time)",neg
"Some may approach, but never none shall hit.",neg
A tongue that served in foreign realms his king;,neg
Whose courteous talk to virtue did enflame,neg
Each noble heart; a worthy guide to bring,neg
"Our English youth, by travail unto fame.",neg
"An eye whose judgment no affect could blind,",neg
"Friends to allure, and foes to reconcile;",neg
Whose piercing look did represent a mind,neg
"With virtue fraught, reposed, void of guile.",neg
A heart where dread yet never so impressed,neg
To hide the thought that might the truth avaunce;,neg
"In neither fortune lift, nor so repressed,",neg
"To swell in wealth, nor yield unto mischance.",neg
"A valiant corps, where force and beauty met,",neg
"Happy, alas! too happy, but for foes,",neg
"Lived, and ran the race that nature set;",neg
"Of manhoods shape, where she the mold did lose.",neg
"But to the heavens that simple soul is fled,",neg
"Which left with such, as covet Christ to know",neg
Witness of faith that never shall be dead:,neg
"Sent for our health, but not received so.",neg
"Thus, for our guilt, this jewel have we lost;",neg
"The earth his bones, the heavens possess his ghost.",neg
"Amen.Twice or thrice had I lov'd thee,",neg
Before I knew thy face or name;,neg
"So in a voice, so in a shapeless flame",neg
"Angels affect us oft, and worshipp'd be;",neg
"         Still when, to where thou wert, I came,",neg
Some lovely glorious nothing I did see.,neg
"         But since my soul, whose child love is,",neg
"Takes limbs of flesh, and else could nothing do,",neg
         More subtle than the parent is,neg
"Love must not be, but take a body too;",neg
"         And therefore what thou wert, and who,",neg
"                I bid Love ask, and now",neg
"That it assume thy body, I allow,",neg
"And fix itself in thy lip, eye, and brow.",neg
"Whilst thus to ballast love I thought,",neg
"And so more steadily to have gone,",neg
"With wares which would sink admiration,",neg
I saw I had love's pinnace overfraught;,neg
         Ev'ry thy hair for love to work upon,neg
"Is much too much, some fitter must be sought;",neg
"         For, nor in nothing, nor in things",neg
"Extreme, and scatt'ring bright, can love inhere;",neg
"         Then, as an angel, face, and wings",neg
"Of air, not pure as it, yet pure, doth wear,",neg
         So thy love may be my love's sphere;,neg
                Just such disparity,neg
"As is 'twixt air and angels' purity,",neg
"'Twixt women's love, and men's, will ever be.",neg
"Alas, madam, for stealing of a kiss",neg
Have I so much your mind there offended?,neg
Have I then done so grievously amiss,neg
That by no means it may be amended?,neg
"Then revenge you, and the next way is this:",neg
"Another kiss shall have my life ended,",neg
For to my mouth the first my heart did suck;,neg
The next shall clean out of my breast it pluck.,neg
"The sovereign beauty which I do admire,",neg
Witness the world how worthy to be praised:,neg
The light whereof hath kindled heavenly fire,neg
"In my frail spirit, by her from baseness raised;",neg
"That being now with her huge brightness dazed,",neg
Base thing I can no more endure to view;,neg
"But looking still on her, I stand amazed",neg
At wondrous sight of so celestial hue.,neg
"So when my tongue would speak her praises due,",neg
It stopped is with thought's astonishment:,neg
"And when my pen would write her titles true,",neg
It ravish'd is with fancy's wonderment:,neg
Yet in my heart I then both speak and write,neg
The wonder that my wit cannot endite.,neg
"ike as a huntsman after weary chase,",neg
"Seeing the game from him escap'd away,",neg
"Sits down to rest him in some shady place,",neg
With panting hounds beguiled of their prey:,neg
"So after long pursuit and vain assay,",neg
"When I all weary had the chase forsook,",neg
"The gentle deer return'd the self-same way,",neg
Thinking to quench her thirst at the next brook.,neg
"There she beholding me with milder look,",neg
"Sought not to fly, but fearless still did bide:",neg
"Till I in hand her yet half trembling took,",neg
And with her own goodwill her firmly tied.,neg
"Strange thing, me seem'd, to see a beast so wild,",neg
"So goodly won, with her own will beguil'd.",neg
"Most happy letters, fram'd by skilful trade,",neg
With which that happy name was first design'd:,neg
"The which three times thrice happy hath me made,",neg
"With gifts of body, fortune, and of mind.",neg
"The first my being to me gave by kind,",neg
"From mother's womb deriv'd by due descent,",neg
"The second is my sovereign Queen most kind,",neg
That honour and large richesse to me lent.,neg
"The third my love, my life's last ornament,",neg
By whom my spirit out of dust was raised:,neg
"To speak her praise and glory excellent,",neg
Of all alive most worthy to be praised.,neg
"Ye three Elizabeths for ever live,",neg
That three such graces did unto me give.,neg
"Men call you fair, and you do credit it,",neg
For that your self ye daily such do see:,neg
"But the true fair, that is the gentle wit,",neg
"And vertuous mind, is much more prais'd of me.",neg
"For all the rest, how ever fair it be,",neg
Shall turn to naught and lose that glorious hue:,neg
But only that is permanent and free,neg
"From frail corruption, that doth flesh ensue.",neg
That is true beauty: that doth argue you,neg
"To be divine, and born of heavenly seed:",neg
"Deriv'd from that fair Spirit, from whom all true",neg
And perfect beauty did at first proceed.,neg
"He only fair, and what he fair hath made,",neg
"All other fair, like flowers untimely fade.",neg
"One day I wrote her name upon the strand,",neg
But came the waves and washed it away:,neg
"Again I wrote it with a second hand,",neg
"But came the tide, and made my pains his prey.",neg
"Vain man, said she, ""that dost in vain assay,",neg
A mortal thing so to immortalize;,neg
"For I myself shall like to this decay,",neg
"And eke my name be wiped out likewise.""",neg
"Not so, (quod I) ""let baser things devise",neg
"To die in dust, but you shall live by fame:",neg
"My verse your vertues rare shall eternize,",neg
And in the heavens write your glorious name:,neg
"Where whenas death shall all the world subdue,",neg
"Our love shall live, and later life renew.",neg
"This holy season, fit to fast and pray,",neg
Men to devotion ought to be inclin'd:,neg
"Therefore I likewise on so holy day,",neg
For my sweet saint some service fit will find.,neg
"Her temple fair is built within my mind,",neg
"In which her glorious image placed is,",neg
"On which my thoughts do day and night attend,",neg
Like sacred priests that never think amiss.,neg
"There I to her as th' author of my bliss,",neg
Will build an altar to appease her ire:,neg
"And on the same my heart will sacrifice,",neg
Burning in flames of pure and chaste desire:,neg
"The which vouchsafe, O goddess, to accept,",neg
Amongst thy dearest relics to be kept.,neg
"AH whither, Love, wilt thou now carry me?",neg
What wontless fury dost thou now inspire,neg
"Into my feeble breast, too full of thee?",neg
"Whilst seeking to aslake thy raging fire,",neg
"Thou in me kindlest much more great desire,",neg
And up aloft above my strength dost raise,neg
The wondrous matter of my fire to praise.,neg
"That as I erst in praise of thine own name,",neg
"So now in honour of thy mother dear,",neg
"An honourable hymn I eke should frame,",neg
"And with the brightness of her beauty clear,",neg
The ravish'd hearts of gazeful men might rear,neg
"To admiration of that heavenly light,",neg
From whence proceeds such soul-enchanting might.,neg
"Thereto do thou, great goddess, queen of beauty,",neg
"Mother of love, and of all world's delight,",neg
Without whose sovereign grace and kindly duty,neg
"Nothing on earth seems fair to fleshly sight,",neg
Do thou vouchsafe with thy love-kindling light,neg
"T' illuminate my dim and dulled eyne,",neg
And beautify this sacred hymn of thine:,neg
"That both to thee, to whom I mean it most,",neg
"And eke to her, whose fair immortal beam",neg
"Hath darted fire into my feeble ghost,",neg
"That now it wasted is with woes extreme,",neg
"It may so please, that she at length will stream",neg
"Some dew of grace into my withered heart,",neg
After long sorrow and consuming smart.,neg
WHAT time this world's great Workmaster did cast,neg
"To make all things such as we now behold,",neg
It seems that he before his eyes had plac'd,neg
"A goodly pattern, to whose perfect mould",neg
He fashion'd them as comely as he could;,neg
"That now so fair and seemly they appear,",neg
As nought may be amended anywhere.,neg
"That wondrous pattern, wheresoe'er it be,",neg
"Whether in earth laid up in secret store,",neg
"Or else in heaven, that no man may it see",neg
"With sinful eyes, for fear it to deflore,",neg
"Is perfect Beauty, which all men adore;",neg
Whose face and feature doth so much excel,neg
"All mortal sense, that none the same may tell.",neg
Thereof as every earthly thing partakes,neg
"Or more or less, by influence divine,",neg
"So it more fair accordingly it makes,",neg
"And the gross matter of this earthly mine,",neg
"Which clotheth it, thereafter doth refine,",neg
Doing away the dross which dims the light,neg
Of that fair beam which therein is empight.,neg
"For, through infusion of celestial power,",neg
"The duller earth it quick'neth with delight,",neg
And lifeful spirits privily doth pour,neg
"Through all the parts, that to the looker's sight",neg
"They seem to please. That is thy sovereign might,",neg
"O Cyprian queen, which flowing from the beam",neg
"Of thy bright star, thou into them dost stream.",neg
That is the thing which giveth pleasant grace,neg
"To all things fair, that kindleth lively fire,",neg
"Light of thy lamp, which, shining in the face,",neg
"Thence to the soul darts amorous desire,",neg
And robs the hearts of those which it admire;,neg
"Therewith thou pointest thy son's poison'd arrow,",neg
"That wounds the life, and wastes the inmost marrow.",neg
"How vainly then do idle wits invent,",neg
That beauty is nought else but mixture made,neg
"Of colours fair, and goodly temp'rament",neg
"Of pure complexions, that shall quickly fade",neg
"And pass away, like to a summer's shade;",neg
Or that it is but comely composition,neg
"Of parts well measur'd, with meet disposition.",neg
"Hath white and red in it such wondrous power,",neg
"That it can pierce through th' eyes unto the heart,",neg
"And therein stir such rage and restless stour,",neg
As nought but death can stint his dolour's smart?,neg
Or can proportion of the outward part,neg
"Move such affection in the inward mind,",neg
That it can rob both sense and reason blind?,neg
"Why do not then the blossoms of the field,",neg
"Which are array'd with much more orient hue,",neg
"And to the sense most dainty odours yield,",neg
Work like impression in the looker's view?,neg
"Or why do not fair pictures like power shew,",neg
In which oft-times we nature see of art,neg
"Excell'd, in perfect limning every part?",neg
